{
  "schema_version": "3",
  "assessment_id": "AndrewMaged814/safelane-demo#41@f43738b1fe17f55ff127fd5555bd4211e58c5797:2026.08.3",
  "assessment_input_sha256": "sha256:aaaaaaaaaaaaaaaaaaaaaaaaaaaaaaaaaaaaaaaaaaaaaaaaaaaaaaaaaaaaaaaa",
  "assessment_result_sha256": "sha256:bbbbbbbbbbbbbbbbbbbbbbbbbbbbbbbbbbbbbbbbbbbbbbbbbbbbbbbbbbbbbbbb",
  "repository": "AndrewMaged814/safelane-demo",
  "pull_request": 41,
  "base_sha": "29a1997f463c7acb7d2e51aa4ee95fa8b3d4a602",
  "head_sha": "f43738b1fe17f55ff127fd5555bd4211e58c5797",
  "service": "demo-api",
  "policy_version": "2026.08.3",
  "tier": "safe",
  "primary_reason": "The change affects at most 2 recognized files and 50 changed lines.",
  "profile": {
    "name": "Fast", "source": "built_in", "traffic_router": "none", "replicas": 5,
    "max_surge": 1, "max_unavailable": 0,
    "stages": [{"set_weight": 100, "exposure_pods": 5, "analysis": false}]
  },
  "analysis": null,
  "resolution": {"type": "automatic", "resolved_at": "2026-08-09T12:00:00Z"}
}
